{
  "id": "brief_4a459da0-9c19-43c6-9dd6-83a688e17eab",
  "workspace_id": "ws_dev",
  "parent_brief_id": null,
  "question": "What are the outstanding deliverables and open questions for the Q3 billing revamp?",
  "mode": "home",
  "status": "published",
  "template_version": "v1",
  "as_of": "2026-09-13T09:16:09.063Z",
  "published_at": "2026-09-13T09:16:09.063Z",
  "title": "Brief: What are the outstanding deliverables and open questions for the Q3 billing revamp?",
  "markdown": "# Brief: What are the outstanding deliverables and open questions for the Q3 billing revamp?\n\nAs of: 2026-09-13T09:16:09.063Z\nMode: home\nStatus: published\n\n## Answer\n- The new Stripe webhook handler is deployed to staging and passing integration checks.\n- Alex needs to confirm the merchant accounts configuration in the new Stripe dashboard.\n- We are waiting on Elena from legal to review the revised consumer terms of service before we enable auto-debit in production. No date promised yet fro\n- Database migration scripts for subscriber tiers are ready, but we should do a dry run on the replica first.\n\n## What I used\n### Private\n- email_thread_billing_01\n### Web\n- None\n### Could not be checked\n- None\n\n## Evidence\n- Claim: The new Stripe webhook handler is deployed to staging and passing integration checks.\n  - [private] email_thread_billing_01 — “The new Stripe webhook handler is deployed to staging and passing integration checks.”\n- Claim: Alex needs to confirm the merchant accounts configuration in the new Stripe dashboard.\n  - [private] email_thread_billing_01 — “Alex needs to confirm the merchant accounts configuration in the new Stripe dashboard.”\n- Claim: We are waiting on Elena from legal to review the revised consumer terms of service before we enable auto-debit in production. No date promised yet fro\n  - [private] email_thread_billing_01 — “We are waiting on Elena from legal to review the revised consumer terms of service before we enable auto-debit in production. No date promised yet from legal.”\n- Claim: Database migration scripts for subscriber tiers are ready, but we should do a dry run on the replica first.\n  - [private] email_thread_billing_01 — “Database migration scripts for subscriber tiers are ready, but we should do a dry run on the replica first.”\n\n## Uncertain / missing\n- None identified.\n\n## Open loops\n- None.\n\n## Actions\n- No actions proposed.\n\n## What I did not do\n- Did not perform actions without verified user approval.\n- No unverified claims published. Withheld ungrounded assumptions.\n",
  "pdf_uri": null,
  "error": null,
  "sections": {
    "answer": "- The new Stripe webhook handler is deployed to staging and passing integration checks.\n- Alex needs to confirm the merchant accounts configuration in the new Stripe dashboard.\n- We are waiting on Elena from legal to review the revised consumer terms of service before we enable auto-debit in production. No date promised yet fro\n- Database migration scripts for subscriber tiers are ready, but we should do a dry run on the replica first.",
    "what_i_used": {
      "private": [
        "email_thread_billing_01"
      ],
      "web": [],
      "unchecked": []
    },
    "evidence": [
      {
        "claim": "The new Stripe webhook handler is deployed to staging and passing integration checks.",
        "citations": [
          {
            "source_class": "private",
            "citation_type": "support",
            "quote": "The new Stripe webhook handler is deployed to staging and passing integration checks.",
            "source_id": "email_thread_billing_01",
            "url": null,
            "claim_span": {
              "start": 729,
              "end": 814
            }
          }
        ]
      },
      {
        "claim": "Alex needs to confirm the merchant accounts configuration in the new Stripe dashboard.",
        "citations": [
          {
            "source_class": "private",
            "citation_type": "support",
            "quote": "Alex needs to confirm the merchant accounts configuration in the new Stripe dashboard.",
            "source_id": "email_thread_billing_01",
            "url": null,
            "claim_span": {
              "start": 952,
              "end": 1038
            }
          }
        ]
      },
      {
        "claim": "We are waiting on Elena from legal to review the revised consumer terms of service before we enable auto-debit in production. No date promised yet fro",
        "citations": [
          {
            "source_class": "private",
            "citation_type": "support",
            "quote": "We are waiting on Elena from legal to review the revised consumer terms of service before we enable auto-debit in production. No date promised yet from legal.",
            "source_id": "email_thread_billing_01",
            "url": null,
            "claim_span": {
              "start": 1177,
              "end": 1327
            }
          }
        ]
      },
      {
        "claim": "Database migration scripts for subscriber tiers are ready, but we should do a dry run on the replica first.",
        "citations": [
          {
            "source_class": "private",
            "citation_type": "support",
            "quote": "Database migration scripts for subscriber tiers are ready, but we should do a dry run on the replica first.",
            "source_id": "email_thread_billing_01",
            "url": null,
            "claim_span": {
              "start": 1538,
              "end": 1645
            }
          }
        ]
      }
    ],
    "uncertain": [],
    "open_loops": [],
    "actions": [],
    "what_i_did_not_do": [
      "Did not perform actions without verified user approval.",
      "No unverified claims published. Withheld ungrounded assumptions."
    ]
  }
}