{
  "id": "brief_afd93490-4eb7-4d41-b39a-38d4a7f4aa17",
  "workspace_id": "ws_dev",
  "parent_brief_id": null,
  "question": "What was the cause of the Redis connection leak in PR #142 and how was it verified?",
  "mode": "home",
  "status": "published",
  "template_version": "v1",
  "as_of": "2026-09-14T13:57:07.656Z",
  "published_at": "2026-09-14T13:57:07.656Z",
  "title": "Brief: What was the cause of the Redis connection leak in PR #142 and how was it verified?",
  "markdown": "# Brief: What was the cause of the Redis connection leak in PR #142 and how was it verified?\n\nAs of: 2026-09-14T13:57:07.656Z\nMode: home\nStatus: published\n\n## Answer\n- Line 84: We are not closing the orphan socket when exponential backoff triggers a reconnect.\n- Commit 4f82a1b explicitly calls client.disconnect() in the catch block before sleeping.\n- Benchmark shows socket count remains flat under simulated 50% packet drop. LGTM to merge.\n\n## What I used\n### Private\n- github_pr_142\n### Web\n- None\n### Could not be checked\n- None\n\n## Evidence\n- Claim: Line 84: We are not closing the orphan socket when exponential backoff triggers a reconnect.\n  - [private] github_pr_142 — “Line 84: We are not closing the orphan socket when exponential backoff triggers a reconnect.”\n- Claim: Commit 4f82a1b explicitly calls client.disconnect() in the catch block before sleeping.\n  - [private] github_pr_142 — “Commit 4f82a1b explicitly calls client.disconnect() in the catch block before sleeping.”\n- Claim: Benchmark shows socket count remains flat under simulated 50% packet drop. LGTM to merge.\n  - [private] github_pr_142 — “Benchmark shows socket count remains flat under simulated 50% packet drop. LGTM to merge.”\n\n## Uncertain / missing\n- None identified.\n\n## Open loops\n- None.\n\n## Actions\n- No actions proposed.\n\n## What I did not do\n- Did not perform actions without verified user approval.\n- No unverified claims published. Withheld ungrounded assumptions.\n",
  "pdf_uri": null,
  "error": null,
  "sections": {
    "answer": "- Line 84: We are not closing the orphan socket when exponential backoff triggers a reconnect.\n- Commit 4f82a1b explicitly calls client.disconnect() in the catch block before sleeping.\n- Benchmark shows socket count remains flat under simulated 50% packet drop. LGTM to merge.",
    "what_i_used": {
      "private": [
        "github_pr_142"
      ],
      "web": [],
      "unchecked": []
    },
    "evidence": [
      {
        "claim": "Line 84: We are not closing the orphan socket when exponential backoff triggers a reconnect.",
        "citations": [
          {
            "source_class": "private",
            "citation_type": "support",
            "quote": "Line 84: We are not closing the orphan socket when exponential backoff triggers a reconnect.",
            "source_id": "github_pr_142",
            "url": null,
            "claim_span": {
              "start": 556,
              "end": 648
            }
          }
        ]
      },
      {
        "claim": "Commit 4f82a1b explicitly calls client.disconnect() in the catch block before sleeping.",
        "citations": [
          {
            "source_class": "private",
            "citation_type": "support",
            "quote": "Commit 4f82a1b explicitly calls client.disconnect() in the catch block before sleeping.",
            "source_id": "github_pr_142",
            "url": null,
            "claim_span": {
              "start": 783,
              "end": 870
            }
          }
        ]
      },
      {
        "claim": "Benchmark shows socket count remains flat under simulated 50% packet drop. LGTM to merge.",
        "citations": [
          {
            "source_class": "private",
            "citation_type": "support",
            "quote": "Benchmark shows socket count remains flat under simulated 50% packet drop. LGTM to merge.",
            "source_id": "github_pr_142",
            "url": null,
            "claim_span": {
              "start": 1000,
              "end": 1089
            }
          }
        ]
      }
    ],
    "uncertain": [],
    "open_loops": [],
    "actions": [],
    "what_i_did_not_do": [
      "Did not perform actions without verified user approval.",
      "No unverified claims published. Withheld ungrounded assumptions."
    ]
  }
}